{
  "calculated_at": "2026-09-01T02:55:59Z",
  "counts": {
    "amber": 0,
    "red": 0
  },
  "level": "green",
  "recommended_next_action": "No corrective action is required.",
  "schema_version": "1.0.0",
  "score": 0,
  "signals": [],
  "summary": "Derived 0 red and 0 amber signal(s); score=0."
}
